{
  "$contract": "soter://contracts/pack/v1",
  "contractVersion": "1.0.0",
  "id": "context.communications",
  "version": "0.1.0",
  "layer": "context",
  "releaseStage": "experimental",
  "evidenceMaturity": "declared",
  "summary": "Defines effect-free provider-neutral communication scope, container, participant, private-content, and typed cross-context-link semantics.",
  "dependencies": [
    {
      "pack": "core.runtime",
      "version": "^0.1.0",
      "optional": false,
      "reason": "Communication definitions require portable context assembly and authority resolution."
    }
  ],
  "capabilities": { "requires": [], "provides": [] },
  "authorities": [
    { "role": "definition", "subject": "communications.semantics.records", "required": true }
  ],
  "effects": [],
  "artifacts": [
    { "path": "soter/contexts/communications/semantics.model.json", "role": "definition" },
    { "path": "soter/contexts/communications/semantics.vocabulary.json", "role": "definition" }
  ],
  "compatibility": { "baseContract": "^1.0.0", "hosts": ["codex", "claude"] },
  "verification": { "maxLevel": "static", "scenarios": [] }
}
