{
  "$contract": "soter://contracts/pack/v1",
  "contractVersion": "1.0.0",
  "id": "automation.writing-adrs",
  "version": "0.1.0",
  "layer": "automation",
  "releaseStage": "experimental",
  "evidenceMaturity": "declared",
  "summary": "Record an architecture decision is preserved as a provider-neutral definition with no runtime or effect authority.",
  "dependencies": [],
  "capabilities": {
    "requires": [],
    "provides": []
  },
  "authorities": [],
  "effects": [],
  "artifacts": [
    {
      "path": "soter/automations/writing-adrs/definition.json",
      "role": "definition"
    },
    {
      "path": "soter/automations/writing-adrs/evaluations.json",
      "role": "evaluation"
    },
    {
      "path": "soter/automations/writing-adrs/guide.json",
      "role": "definition"
    }
  ],
  "compatibility": {
    "baseContract": "^1.0.0",
    "hosts": [
      "codex",
      "claude"
    ]
  },
  "verification": {
    "maxLevel": "static",
    "scenarios": []
  }
}
