{
  "$contract": "soter://contracts/pack/v1",
  "contractVersion": "1.0.0",
  "id": "core.runtime",
  "version": "0.1.0",
  "layer": "core",
  "releaseStage": "experimental",
  "evidenceMaturity": "declared",
  "summary": "Provides configuration resolution, context assembly, capability binding, effect policy, durable host execution services, evidence, and health.",
  "dependencies": [
    {
      "pack": "kernel.soter",
      "version": "^0.1.0",
      "optional": false,
      "reason": "Core runtime contracts are governed and verified by the Soter kernel."
    }
  ],
  "capabilities": {
    "requires": [],
    "provides": []
  },
  "authorities": [
    { "role": "evidence", "subject": "runtime.runs", "required": true }
  ],
  "effects": [],
  "artifacts": [
    { "path": "package.json", "role": "implementation" },
    { "path": "package-lock.json", "role": "implementation" },
    { "path": "soter/core/lib/canonical-json.mjs", "role": "implementation" },
    { "path": "soter/core/resolve.mjs", "role": "implementation" },
    { "path": "soter/core/configuration-view.mjs", "role": "implementation" },
    { "path": "soter/core/run.mjs", "role": "implementation" },
    { "path": "soter/core/evidence.mjs", "role": "implementation" },
    { "path": "soter/core/doctor.mjs", "role": "implementation" },
    { "path": "soter/core/capabilities.mjs", "role": "implementation" },
    { "path": "soter/core/context-records.mjs", "role": "implementation" },
    { "path": "soter/core/host-runtime.mjs", "role": "implementation" },
    { "path": "soter/core/host-projections.mjs", "role": "implementation" },
    { "path": "soter/core/host-realizations.mjs", "role": "implementation" },
    { "path": "soter/core/host-realizations.selftest.mjs", "role": "evaluation" },
    { "path": "soter/core/host-runtime-inspection.mjs", "role": "implementation" },
    { "path": "soter/core/host-tools.mjs", "role": "implementation" },
    { "path": "soter/core/operation-plans.mjs", "role": "implementation" },
    { "path": "soter/core/configuration-preview.mjs", "role": "implementation" },
    { "path": "soter/core/configuration-preview.selftest.mjs", "role": "evaluation" },
    { "path": "soter/core/configuration-transactions.mjs", "role": "implementation" },
    { "path": "soter/core/configuration-transactions.selftest.mjs", "role": "evaluation" },
    { "path": "soter/core/automation-input.selftest.mjs", "role": "evaluation" },
    { "path": "soter/core/prepared-work.mjs", "role": "implementation" },
    { "path": "soter/core/review-projections.mjs", "role": "implementation" },
    { "path": "soter/core/automation-proposals.mjs", "role": "implementation" },
    { "path": "soter/core/automation-proposals.selftest.mjs", "role": "evaluation" },
    { "path": "soter/core/prepared-work.selftest.mjs", "role": "evaluation" },
    { "path": "soter/core/prepared-review-batches.mjs", "role": "implementation" },
    { "path": "soter/core/prepared-review-batches.selftest.mjs", "role": "evaluation" },
    { "path": "soter/core/prepared-connected-plans.mjs", "role": "implementation" },
    { "path": "soter/core/prepared-connected-plans.selftest.mjs", "role": "evaluation" },
    { "path": "soter/core/connected-compilers.mjs", "role": "implementation" },
    { "path": "soter/core/proposal-connected-batches.mjs", "role": "implementation" },
    { "path": "soter/core/inspection.mjs", "role": "implementation" },
    { "path": "soter/core/inspection.selftest.mjs", "role": "evaluation" },
    { "path": "soter/core/maturity.mjs", "role": "implementation" },
    { "path": "soter/core/provider-probes.mjs", "role": "implementation" },
    { "path": "soter/core/provider-probe-plans.mjs", "role": "implementation" },
    { "path": "soter/core/service.mjs", "role": "implementation" },
    { "path": "soter/core/runtime-state.mjs", "role": "implementation" },
    { "path": "soter/core/mcp/tools.mjs", "role": "implementation" },
    { "path": "soter/core/mcp/server.mjs", "role": "implementation" },
    { "path": "soter/core/mcp/selftest.mjs", "role": "evaluation" },
    { "path": "soter/core/context.mjs", "role": "implementation" },
    { "path": "soter/core/transaction.mjs", "role": "implementation" },
    { "path": "soter/core/connected-transactions.mjs", "role": "implementation" },
    { "path": "soter/core/operator-authority.mjs", "role": "implementation" },
    { "path": "soter/core/connected-approval-review.mjs", "role": "implementation" },
    { "path": "soter/core/operator-inspection.mjs", "role": "implementation" },
    { "path": "soter/core/connected-transaction-runtime.mjs", "role": "implementation" },
    { "path": "soter/core/verified-connected-transaction-runtime.mjs", "role": "implementation" },
    { "path": "soter/core/fixtures.mjs", "role": "implementation" },
    { "path": "soter/core/cli.mjs", "role": "implementation" },
    { "path": "soter/core/selftest.mjs", "role": "evaluation" },
    { "path": "soter/fixtures/operator-inspection/connected-transaction.lifecycle.json", "role": "evaluation" },
    { "path": "soter/fixtures/operator-inspection/input-summary.json", "role": "evaluation" }
  ],
  "compatibility": {
    "baseContract": "^1.0.0",
    "hosts": ["codex", "claude"]
  },
  "verification": {
    "maxLevel": "static",
    "scenarios": []
  }
}
