{
  "$contract": "soter://contracts/pack/v1",
  "contractVersion": "1.0.0",
  "id": "context.calendar",
  "version": "0.1.0",
  "layer": "context",
  "releaseStage": "experimental",
  "evidenceMaturity": "declared",
  "summary": "Defines portable standing-commitment meaning, external time-source joins, and exact domain relations without synchronization authority.",
  "dependencies": [],
  "capabilities": { "requires": [], "provides": [] },
  "authorities": [
    { "role": "definition", "subject": "calendar.records", "required": true },
    { "role": "instance", "subject": "calendar.records", "required": true }
  ],
  "effects": [],
  "artifacts": [
    { "path": "soter/contexts/calendar/records.model.json", "role": "definition" },
    { "path": "soter/contexts/calendar/vocabulary.json", "role": "definition" }
  ],
  "compatibility": { "baseContract": "^1.0.0", "hosts": ["codex", "claude"] },
  "verification": { "maxLevel": "static", "scenarios": [] }
}
